[
  {
    "symbol_latex": "F",
    "pdg_id": "0000004202",
    "local_id_in_derivation": "local-id-2b1c8a7f-ea5c-46ba-8a75-822ec7e0368a",
    "equation_labels": [
      "eq_newton_second_law",
      "eq_force_ma_derivative",
      "eq_hookes_law",
      "eq_force_equality"
    ],
    "description": "Net force acting on the object.",
    "explanation": "Matches the scalar force entry in the database with identical physical dimensions (M^1 L^1 T^-2).",
    "confidence": "high"
  },
  {
    "symbol_latex": "m",
    "pdg_id": "0000005156",
    "local_id_in_derivation": "local-id-472a2a07-e045-4bd0-9801-3413c6c8ce34",
    "equation_labels": [
      "eq_newton_second_law",
      "eq_force_ma_derivative",
      "eq_force_equality",
      "eq_normalized_ode",
      "eq_omega_squared_def",
      "eq_omega_definition",
      "eq_specific_solution",
      "eq_freq_derivation_step",
      "eq_frequency_formula",
      "eq_period_formula"
    ],
    "description": "Mass of the oscillator.",
    "explanation": "Matches the standard mass scalar symbol in the database with dimension M^1.",
    "confidence": "high"
  },
  {
    "symbol_latex": "a",
    "pdg_id": "0000009140",
    "local_id_in_derivation": "local-id-37747774-aeb2-4f7e-a2da-3bad5b96f6d4",
    "equation_labels": [
      "eq_newton_second_law",
      "eq_a_derivative_op",
      "eq_accel_cos",
      "eq_acceleration_pos_form",
      "eq_a_max"
    ],
    "description": "Acceleration of the object.",
    "explanation": "Matches the scalar acceleration entry in the database with dimensions L^1 T^-2.",
    "confidence": "high"
  },
  {
    "symbol_latex": "x",
    "pdg_id": "0000004037",
    "local_id_in_derivation": "local-id-36bd81d8-a223-41d8-9897-bbe60d07d972",
    "equation_labels": [
      "eq_force_ma_derivative",
      "eq_hookes_law",
      "eq_force_equality",
      "eq_normalized_ode",
      "eq_ode_with_omega",
      "eq_general_solution",
      "eq_eval_pos_zero",
      "eq_c1_is_x0",
      "eq_specific_solution",
      "eq_amplitude_phase_form",
      "eq_trig_expansion",
      "x_squared",
      "eq_v_squared_final",
      "eq_speed_pos_form",
      "eq_acceleration_pos_form"
    ],
    "description": "Displacement from the equilibrium position.",
    "explanation": "Matches the position/displacement scalar coordinate with length dimension L^1.",
    "confidence": "high"
  },
  {
    "symbol_latex": "t",
    "pdg_id": "0000001467",
    "local_id_in_derivation": "local-id-6ba8abfc-a2b6-42de-bfa3-feb0a7ea807f",
    "equation_labels": [
      "eq_force_ma_derivative",
      "eq_normalized_ode",
      "eq_ode_with_omega",
      "eq_general_solution",
      "eq_velocity_def",
      "eq_velocity_derivation",
      "eq_specific_solution",
      "eq_amplitude_phase_form",
      "eq_trig_expansion",
      "eq_velocity_time_form",
      "eq_v_squared",
      "eq_v_squared_trig",
      "x_squared",
      "eq_accel_cos"
    ],
    "description": "Time.",
    "explanation": "Matches the standard scalar time variable with dimension T^1.",
    "confidence": "high"
  },
  {
    "symbol_latex": "k",
    "pdg_id": "0000001356",
    "local_id_in_derivation": "local-id-33386c99-1c45-4150-8ca1-e9dd5b155f37",
    "equation_labels": [
      "eq_hookes_law",
      "eq_force_equality",
      "eq_normalized_ode",
      "eq_omega_squared_def",
      "eq_omega_definition",
      "eq_specific_solution",
      "eq_freq_derivation_step",
      "eq_frequency_formula",
      "eq_period_formula"
    ],
    "description": "Spring constant (restoring force constant).",
    "explanation": "Matches linear stiffness / spring constant in the database with dimensions M^1 T^-2.",
    "confidence": "high"
  },
  {
    "symbol_latex": "\\omega",
    "pdg_id": "0000002321",
    "local_id_in_derivation": "local-id-d44d3b33-1ad0-42f5-b057-34d6a7320b82",
    "equation_labels": [
      "eq_omega_squared_def",
      "eq_omega_definition",
      "eq_ode_with_omega",
      "eq_general_solution",
      "eq_velocity_derivation",
      "eq_eval_vel_zero",
      "eq_vel_c2_relation",
      "eq_c2_is_v0_omega",
      "eq_amplitude_phase_form",
      "eq_trig_expansion",
      "eq_velocity_time_form",
      "eq_v_max",
      "eq_v_squared",
      "eq_v_squared_trig",
      "eq_v_squared_final",
      "eq_speed_pos_form",
      "eq_accel_cos",
      "eq_acceleration_pos_form",
      "eq_a_max",
      "eq_omega_frequency_relation",
      "eq_freq_derivation_step"
    ],
    "description": "Angular frequency.",
    "explanation": "Matches angular frequency with dimension T^-1.",
    "confidence": "high"
  },
  {
    "symbol_latex": "c_1",
    "pdg_id": "4133185897",
    "local_id_in_derivation": "local-id-9a77cca8-3330-46c1-87bb-287a96c3abf5",
    "equation_labels": [
      "eq_general_solution",
      "eq_eval_pos_zero",
      "eq_c1_is_x0",
      "eq_velocity_derivation",
      "eq_eval_vel_zero",
      "eq_coeff_c1",
      "eq_pythagorean_sum",
      "eq_pythagorean_factor",
      "eq_amplitude_def",
      "eq_tangent_ratio",
      "eq_phase_def",
      "eq_complex_magnitude",
      "eq_complex_argument"
    ],
    "description": "First constant of integration, representing initial position.",
    "explanation": "Matches constant of solution to differential equation c_1 with length dimension L^1.",
    "confidence": "high"
  },
  {
    "symbol_latex": "c_2",
    "pdg_id": "1777778008",
    "local_id_in_derivation": "local-id-e55014c2-f6d4-44c7-8f7c-e8da3e1dbba4",
    "equation_labels": [
      "eq_general_solution",
      "eq_eval_pos_zero",
      "eq_velocity_derivation",
      "eq_eval_vel_zero",
      "eq_vel_c2_relation",
      "eq_c2_is_v0_omega",
      "eq_coeff_c2",
      "eq_pythagorean_sum",
      "eq_pythagorean_factor",
      "eq_amplitude_def",
      "eq_tangent_ratio",
      "eq_phase_def",
      "eq_complex_magnitude",
      "eq_complex_argument"
    ],
    "description": "Second constant of integration, related to initial velocity.",
    "explanation": "Matches constant of solution to differential equation c_2 with length dimension L^1.",
    "confidence": "high"
  },
  {
    "symbol_latex": "x_0",
    "pdg_id": "0000001572",
    "local_id_in_derivation": "local-id-98c268e5-2634-49ec-a8bb-e46598665143",
    "equation_labels": [
      "eq_c1_is_x0",
      "eq_specific_solution"
    ],
    "description": "Initial position at t=0.",
    "explanation": "Matches initial position x_0 with length dimension L^1.",
    "confidence": "high"
  },
  {
    "symbol_latex": "v",
    "pdg_id": "0000001357",
    "local_id_in_derivation": "local-id-c8d2a4e9-e699-4fa3-8be1-1440114fca2a",
    "equation_labels": [
      "eq_velocity_def",
      "eq_velocity_derivation",
      "eq_eval_vel_zero",
      "eq_vel_c2_relation",
      "eq_v_derivative_op",
      "eq_velocity_time_form",
      "eq_v_squared",
      "eq_v_squared_trig",
      "eq_v_squared_final",
      "eq_speed_pos_form",
      "eq_a_derivative_op"
    ],
    "description": "Velocity of the object.",
    "explanation": "Matches the scalar velocity variable with dimensions L^1 T^-1.",
    "confidence": "high"
  },
  {
    "symbol_latex": "v_0",
    "pdg_id": "0000005153",
    "local_id_in_derivation": "local-id-8ad94a3e-bd38-4e6f-a538-623cdcfac9db",
    "equation_labels": [
      "eq_c2_is_v0_omega",
      "eq_specific_solution"
    ],
    "description": "Initial velocity at t=0.",
    "explanation": "Matches the scalar initial velocity v_0 with dimensions L^1 T^-1.",
    "confidence": "high"
  },
  {
    "symbol_latex": "A",
    "pdg_id": "0000009885",
    "local_id_in_derivation": "local-id-c1ff3c90-e078-4826-a2b9-e8999fd45bea",
    "equation_labels": [
      "eq_amplitude_phase_form",
      "eq_trig_expansion",
      "eq_coeff_c1",
      "eq_coeff_c2",
      "eq_pythagorean_sum",
      "eq_pythagorean_factor",
      "eq_amplitude_def",
      "eq_tangent_ratio",
      "eq_complex_magnitude",
      "eq_velocity_time_form",
      "eq_v_max",
      "eq_v_squared",
      "eq_v_squared_trig",
      "x_squared",
      "eq_v_squared_final",
      "eq_speed_pos_form",
      "eq_accel_cos",
      "eq_a_max"
    ],
    "description": "Amplitude of the oscillation.",
    "explanation": "Matches the amplitude symbol A in the database.",
    "confidence": "high"
  },
  {
    "symbol_latex": "\\phi",
    "pdg_id": "0000008586",
    "local_id_in_derivation": "local-id-de618ec0-a793-4551-b588-cb9a024749a5",
    "equation_labels": [
      "eq_amplitude_phase_form",
      "eq_trig_expansion",
      "eq_coeff_c1",
      "eq_coeff_c2",
      "eq_pythagorean_sum",
      "eq_pythagorean_factor",
      "euler_eq",
      "eq_tangent_ratio",
      "eq_phase_def",
      "eq_complex_argument",
      "eq_velocity_time_form",
      "eq_v_squared",
      "eq_v_squared_trig",
      "x_squared",
      "eq_accel_cos"
    ],
    "description": "Phase shift constant.",
    "explanation": "Matches the angular quantity \\phi representing the phase shift / phase angle.",
    "confidence": "high"
  },
  {
    "symbol_latex": "\\alpha",
    "pdg_id": "2357809348",
    "local_id_in_derivation": "local-id-a1860e4a-f630-4088-b246-042a72f27be3",
    "equation_labels": [
      "cos_difference"
    ],
    "description": "Arbitrary variable used in trigonometric identity.",
    "explanation": "Matches the generic angle / variable \\alpha in the database.",
    "confidence": "high"
  },
  {
    "symbol_latex": "\\beta",
    "pdg_id": "3923126873",
    "local_id_in_derivation": "local-id-6d3be11b-315d-454a-b3cf-3c88d04b7fea",
    "equation_labels": [
      "cos_difference",
      "sin_squared"
    ],
    "description": "Arbitrary variable used in trigonometric identity.",
    "explanation": "Matches the generic angle / variable \\beta in the database.",
    "confidence": "high"
  },
  {
    "symbol_latex": "i",
    "pdg_id": "0000004621",
    "local_id_in_derivation": "local-id-51ce99e4-4bcc-419a-a583-079ba394147a",
    "equation_labels": [
      "eq_complex_magnitude",
      "eq_complex_argument"